{
  "description": "Panel-break triggers (Tier-3 #1). Walks the drivers at panel.cpp:1079 deliberately: five-plus balloons accumulating in one panel, the same speaker sending twice in a row (speaker-already-present), an explicit <Brk>, and an ACTION message. panelsWide is 3 rather than the 2 every other case uses, so per-row fitting and the interstice math get exercised too.",
  "seed": 2024,
  "tickSeedBase": 1000,
  "panelsWide": 3,
  "treeDir": ".",
  "avatars": [
    { "name": "anna", "speakerId": 1 },
    { "name": "cro", "speakerId": 2 },
    { "name": "connor", "speakerId": 3 }
  ],
  "messages": [
    { "speakerId": 1, "text": "one", "mode": 0 },
    { "speakerId": 2, "text": "two", "mode": 0 },
    { "speakerId": 3, "text": "three", "mode": 0 },
    { "speakerId": 1, "text": "four", "mode": 0 },
    { "speakerId": 2, "text": "five", "mode": 0 },
    { "speakerId": 3, "text": "six pushes past the five-balloon limit", "mode": 0 },
    { "speakerId": 1, "text": "seven from a speaker already in the panel", "mode": 0 },
    { "speakerId": 1, "text": "eight from that same speaker again", "mode": 0 },
    { "speakerId": 2, "text": "before the break<Brk>after the break", "mode": 0 },
    { "speakerId": 3, "text": "waves at the room", "mode": 4 },
    { "speakerId": 1, "text": "back to normal", "mode": 0 }
  ]
}
