{
  "seed": 42,
  "tickSeedBase": 1000,
  "panelsWide": 2,
  "avatars": [
    {"name": "bolo", "speakerId": 1}
  ],
  "messages": [
    {"speakerId": 1, "text": "", "mode": 0},
    {"speakerId": 1, "text": "A", "mode": 0},
    {"speakerId": 1, "text": "This is a very long message that should definitely cause line wrapping and possibly overflow into multiple lines within the balloon, testing the GDI GetTextExtent measurement path and the balloon line breaking logic thoroughly and completely yes indeed this is quite long indeed.", "mode": 0},
    {"speakerId": 1, "text": "Unicode test: caf\u00e9 r\u00e9sum\u00e9 na\u00efve", "mode": 0},
    {"speakerId": 1, "text": "SHOUTING IN CAPS!!! THIS IS IMPORTANT!!!", "mode": 0},
    {"speakerId": 1, "text": "I am waving hello :)", "mode": 0}
  ]
}