{
  "seed": 42,
  "tickSeedBase": 1000,
  "panelsWide": 2,
  "treeDir": ".",
  "avatars": [
    {
      "name": "bolo",
      "speakerId": 1
    },
    {
      "name": "anna",
      "speakerId": 2
    },
    {
      "name": "armando",
      "speakerId": 3
    },
    {
      "name": "connor",
      "speakerId": 4
    },
    {
      "name": "dan",
      "speakerId": 5
    },
    {
      "name": "denise",
      "speakerId": 6
    }
  ],
  "messages": [
    {
      "speakerId": 1,
      "text": "One speaker so far.",
      "mode": 0
    },
    {
      "speakerId": 2,
      "text": "Now two speakers.",
      "mode": 0
    },
    {
      "speakerId": 3,
      "text": "Three speakers in the room.",
      "mode": 0
    },
    {
      "speakerId": 4,
      "text": "Four speakers now.",
      "mode": 0
    },
    {
      "speakerId": 5,
      "text": "Five speakers chatting.",
      "mode": 0
    },
    {
      "speakerId": 6,
      "text": "Six speakers - full panel!",
      "mode": 0
    }
  ]
}
