{
  "seed": 42,
  "tickSeedBase": 1000,
  "panelsWide": 2,
  "treeDir": ".",
  "avatars": [
    {
      "name": "cro",
      "speakerId": 1
    },
    {
      "name": "denise",
      "speakerId": 2
    },
    {
      "name": "lynnea",
      "speakerId": 3
    },
    {
      "name": "veronica",
      "speakerId": 4
    }
  ],
  "messages": [
    {
      "speakerId": 1,
      "text": "I am using the cro avatar.",
      "mode": 1
    },
    {
      "speakerId": 2,
      "text": "I am using the denise avatar.",
      "mode": 1
    },
    {
      "speakerId": 3,
      "text": "I am using the lynnea avatar.",
      "mode": 1
    },
    {
      "speakerId": 4,
      "text": "I am using the veronica avatar.",
      "mode": 1
    }
  ]
}
