{
  "seed": 42,
  "tickSeedBase": 1000,
  "panelsWide": 2,
  "avatars": [
    {"name": "bolo", "speakerId": 1},
    {"name": "anna", "speakerId": 2}
  ],
  "messages": [
    {"speakerId": 1, "text": "Hello there! How are you?", "mode": 0},
    {"speakerId": 2, "text": "I'm doing great, thanks for asking!", "mode": 0},
    {"speakerId": 1, "text": "That's wonderful to hear.", "mode": 0}
  ]
}